Source Lot,Source Code,Lbs Shipped,Seeds/Lb,100-Seed Wt (G),Species Code,Common Name,Genus,Species,label ss,SubSpecies,label var,Variety,NAME,FAMILY,ABBREV_NAME,COLL_DT,ACC_NUM,COLL_NUM,COLL_ID,COLLECTOR,COLLECTED_WITH,COUNTRY_CODE,PHYTOREGION,PHYTOREGION_FULL,SUB_CNT1,SUB_CNT2,SUB_CNT3,GEOG_AREA,LOCALITY,LATITUDE,LONGITUDE,LATITUDE_DECIMAL,LONGITUDE_DECIMAL,GEOREF_SOURCE,GPS_DATUM,ALTITUDE,ALTITUDE_UNIT,LAND_OWNER,ASSOCIATED_TAXA_FULL,USER2,GEOMORPHOLOGY,SLOPE,ASPECT,HABITAT,USER1,GEOLOGY,SOIL_TYPE,COLLECTION_MISC,POPULATION_SIZE,OCCUPANCY,SEED_SOURCE,DESCRIPTION,USER3,USER4,USER5,KEYWORD,PSOURCE_FULL,SECOND_COLL_DT,DATE_AS_GIVEN,USER10,SECONDARY_ID,CREATED_BY,USER8,USER9,ACC_DT,GENUS,SPECIES,COLL_YR,MISC
'SOS-CA930A-988,BOBAB3-SOS-CA930A-988-SANBERNARDINO-21,0.0043,"3,985,940",0.0113,BOBAB3,sixweeks grama,Bouteloua,barbata,,,var.,barbata,Bouteloua barbata var. barbata,POACEAE,Bouteloua barbata var. barbata,12-Oct-21,CA930A-988,988,CA930A,,"S. Estrada, D. Bell, N. Fraga",US,14E,Mojave Basin and Range (Omernik),California,San Bernadino,Needles Field Office,,"Mescal Range: NE foot of the Mescal Range. Bailey Rd. exit off Hwy-15, 0.8 road mi down Zinc Mine/White Eagle Rd. Collected on a hillside adjacent to White Eagle Rd.",,"115°30' 58.5"" W",35.4648,-115.51625,GPS,NAD83,4503,FT,BLM,Yucca schidigera:Yucca baccata:Coleogyne ramosissima:Prosopis glandulosa:Gutierrezia microcephala:Chilopsis linearis ssp. arcuata:Amaranthus fimbriatus:Bouteloua barbata var. barbata:Scutellaria ovata ssp. mexicana:Cylindropuntia acanthocarpa:Lycium cooperi:Ambrosia salsola:Ephedra sp.,,Base of hill,5,NW,Base of hill. Mojave yucca and Black brush scrub.,Recreation,Older alluvium within pre-Cambrian augen gneiss complex.,Loam,950 plants sampled,>10000,20,P,,,S. Estrada,3,,,,2021,0,Estrada 39,WEB,0.5,5 YR 3/4 dark reddish brown,11/30/2021,BOUTELOUA,barbata,2021,
'SOS-CA930A-989,AMFI-SOS-CA930A-989-SANBERNARDINO-21,0.004,"2,831,460",0.016,AMFI,fringed amaranth,Amaranthus,fimbriatus,,,,,Amaranthus fimbriatus,AMARANTHACEAE,AMFI,12-Oct-21,CA930A-989,989,CA930A,,"S. Estrada, D. Bell, N. Fraga",US,14E,Mojave Basin and Range (Omernik),California,San Bernadino,Needles Field Office,,"Mescal Range: NE foot of the Mescal Range. Bailey Rd. exit off Hwy-15, 0.8 road mi down Zinc Mine/White Eagle Rd. Collected on a hillside adjacent to White Eagle Rd.",,"115°30' 58.5"" W",35.4648,-115.51625,GPS,NAD83,4503,FT,BLM,Yucca schidigera:Yucca baccata:Prosopis glandulosa:Gutierrezia microcephala:Chilopsis linearis ssp. arcuata:Amaranthus fimbriatus:Bouteloua barbata var. barbata:Scutellaria ovata ssp. mexicana:Scutellaria ovata ssp. mexicana:Cylindropuntia acanthocarpa:Lycium cooperi:Ambrosia salsola:Ephedra sp.,Feral donkeys,Base of hill,5,NW,Sandy wash. Creosote scrub.,Recreation,Older alluvium within pre-Cambrian augen gneiss complex.,Loam,250 plants sampled,"5,000",2,P,,,S. Estrada,3,,,,2021,0,Estrada 10,WEB,2,5 YR 3/4 dark reddish brown,11/30/2021,AMARANTHUS,fimbriatus,2021,
'SOS-CA930A-990,EUMI3-SOS-CA930A-990-SANBERNARDINO-21,0.0036,"4,086,486",0.011,EUMI3,Sonoran sandmat,Euphorbia,micromera,,,,,Chamaesyce micromera,EUPHORBIACEAE,CHMI7,13-Oct-21,CA930A-990,990,CA930A,,"S. Estrada, D. Bell",US,14E,Mojave Basin and Range (Omernik),California,San Bernadino,Needles Field Office,,"Canyon/Wash E from Goffs, 2.3 road miles east on Goffs Rd, S from railroad tracks at the northernmost end of the Piute Mountains adjacent to Goffs Rd.",,"115°01' 26.1"" W",34.91375,-115.02391,GPS,NAD83,2582,FT,BLM,Larrea tridentata:Yucca schidigera:Senna armata:Hilaria rigida:Amaranthus fimbriatus:Pectis papposa var. papposa:Chamaesyce setiloba,Flooded,Wash,0-2,N,Sandy wash. Desert wash.,Recreation,Abundant hillslope deposits from Holocene and Pleistocene origin with metamorphic rocks of pre-quaternary origin.,Sand: Gravel,250 plants sampled,"5,000",5,P,,,S. Estrada,3,,,,2021,0,Estrada 12,WEB,0.2,10 YR 3/3 dark brown,11/30/2021,CHAMAESYCE,micromera,2021,
'SOS-CA930A-992,GUMI-SOS-CA930A-992-SANBERNARDINO-21,0.0132,"963,057",0.047,GUMI,threadleaf snakeweed,Gutierrezia,microcephala,,,,,Gutierrezia microcephala,ASTERACEAE,GUMI,14-Oct-21,CA930A-992,992,CA930A,,"S. Estrada, D. Bell",US,14E,Mojave Basin and Range (Omernik),California,San Bernadino,Barstow Field Office,Mottino Wash,Rattlesnake Canyon: SW from Bighorn Mountains and E from Baldwin Lake. 6.5 air miles S from Hwy-247 and Rattlesnake Canyon Rd junction. Collected S of Mottino Wash.,,"116°39' 46.3"" W",34.27519,-116.66286,GPS,NAD83,5121,FT,BLM,Chilopsis linearis ssp. arcuata:Eriodictyon trichocalyx:Ericameria nauseosa:Lepidospartum squamatum:Cylindropuntia echinocarpa:Chamaesyce setiloba,"Cattle, ohv",Wash,0-1,N,Sandy wash. Desert wash.,"Recreation, Grazing","Mesozoic dioritic rocks, hornblende diorite or gabbro, surrounded by gneiss quartzite with a fine-grained texture of Paleozoic origin.","Sand, Other:Gravel",120 plants sampled,"5,000",5,P,,,S. Estrada,3,,,,2021,0,Estrada 17,WEB,2,2.5 YR 4/4 olive brown,11/30/2021,GUTIERREZIA,microcephala,2021,
'SOS-CA930A-993,CHLIA-SOS-CA930A-993-SANBERNARDINO-21,0.2111,"61,663",0.7355,CHLIA,desert willow,Chilopsis,linearis,spp.,arcuata,,,Chilopsis linearis ssp. arcuata,BIGNONIACEAE,CHLIA,14-Oct-21,CA930A-993,993,CA930A,,"S. Estrada, D. Bell",US,14E,Mojave Basin and Range (Omernik),California,San Bernadino,Barstow Field Office,Mottino Wash,Rattlesnake Canyon: SW from Bighorn Mountains and E from Baldwin Lake. 6.5 air miles S from Hwy-247 and Rattlesnake Canyon Rd junction. Collected S of Mottino Wash.,"34°16' 30.7"" N","116°39' 46.3"" W",34.27519,-116.66286,GPS,NAD83,5121,FT,BLM,Gutierrezia microcephala:Eriodictyon trichocalyx:Ericameria nauseosa:Lepidospartum squamatum:Cylindropuntia echinocarpa:Chamaesyce setiloba,"Cattle, ohv",Wash,0-1,N,Sandy wash. Creosote scrub.,"Recreation, Grazing","Mesozoic dioritic rocks, hornblende diorite or gabbro, surrounded by gneiss quartzite with a fine-grained texture of Paleozoic origin.",Sand: Gravel,125 plants sampled,"2,000",5,P,,,S. Estrada,3,,,,2021,0,Estrada 18,WEB,15,2.5 YR 4/4 olive brown,11/30/2021,CHILOPSIS,linearis,2021,
'SOS-CA930A-994,PEPAP3-SOS-CA930A-994-SANBERNARDINO-21,0.0109,"4,000,000",0.0113,PEPAP3,manybristle chinchweed,Pectis,papposa,,,var.,papposa,Pectis papposa var. papposa,ASTERACEAE,PEPAP3,13-Oct-21,CA930A-994,994,CA930A,,"S. Estrada, D. Bell",US,14E,Mojave Basin and Range (Omernik),California,San Bernadino,Needles Field Office,,"Canyon/Wash E from Goffs, 2.3 road miles east on Goffs Rd, S from railroad tracks at the northernmost end of the Piute Mountains adjacent to Goffs Rd.",,"115°01' 26.1"" W",34.91375,-115.02391,GPS,NAD83,2582,FT,BLM,Larrea tridentata:Yucca schidigera:Senna armata:Hilaria rigida:Amaranthus fimbriatus:Chamaesyce setiloba:Chamaesyce micromera,Flooded,Wash,0-2,N,Base of hill. Mojave yucca and Black brush scrub.,Recreation,Abundant hillslope deposits from Holocene and Pleistocene origin with metamorphic rocks of pre-quaternary origin.,Sand: Gravel,250 plants sampled,"5,000",5,P,,,S. Estrada,3,,,,2021,,Estrada 11,WEB,0.2,10 YR 3/3 dark brown,11/30/2021,PECTIS,papposa,2021,
'SOS-CA930A-995,MUPO2-SOS-CA930A-995-SANBERNARDINO-21,0.0063,"2,137,606",0.0212,MUPO2,bush muhly,Muhlenbergia,porteri,,,,,Muhlenbergia porteri,POACEAE,MUPO2,5-Nov-21,CA930A-995,995,CA930A,,"N. Fraga, C. Birker",US,14E,Mojave Basin and Range (Omernik),California,San Bernadino,Needles Field Office,,"Mescal Range: NE foot of the Mescal Range. Bailey Rd. exit off Hwy-15, 0.8 road mi down Zinc Mine/White Eagle Rd. Collected on a hillside adjacent to White Eagle Rd.","35°27' 53.3"" N","115°30' 58.5"" W",35.4648,-115.51625,GPS,NAD83,4503,FT,BLM,Yucca schidigera:Yucca baccata:Coleogyne ramosissima:Prosopis glandulosa:Chilopsis linearis ssp. arcuata:Amaranthus fimbriatus:Bouteloua barbata:Bouteloua barbata var. barbata:Scutellaria ovata ssp. mexicana:Cylindropuntia acanthocarpa:Lycium cooperi:Ambrosia salsola:Ephedra sp.,Feral donkeys,Base of hill,5,NW,"Moderately deep well drained soils. The mean precipitation is 14 inches with a slope variation of 2-8% on mountain slope. Mixture of perennial grasses, juniper woodland, and sagebrush scrubland. Warner Mountain Ecoregion. Ashtre soil type association.",Recreation,Older alluvium within pre-Cambrian augen gneiss complex.,Other : Loam,374 plants sampled,500,8,P,,,S. Estrada,3,,,,2021,0,Estrada 38,WEB,0.5-2,5 YR 3/4 dark reddish brown,11/30/2021,MUHLENBERGIA,porteri,2021,
'SOS-CA370-278,PUTR2-SOS-CA370-278-MODOC-21,0.5520," 21,402 ",2.1193,PUTR2,antelope bitterbrush,Purshia,tridentata,,,,,Purshia tridentata,ROSACEAE,PUTR2,9-Jul-21,CA370-278,278,CA370,,Jen Mueller,US,80E,Northwestern Basin and Range (Omernik),California,Modoc,"Applegate FO, Surprise Field Station",Cowhead Gravel Pit,"From Fort Bidwell, CA travel .5 miles down CO RD 1 to the junction of CO RD 1 and CO RD 6. Turn north onto CO RD 1, and drive 6 miles. The population is along both sides of CO RD 1. A half mile further, a road to the right takes you to the Cowhead Community Gravel Pit.","41°55' 29.3019"" N","120°04' 10.8983"" W",41.9248,-120.06969,GPS,NAD83,5473,FT,BLM,Juniperus occidentalis:Poa secunda:Leymus cinereus:Wyethia mollis:Lupinus argenteus,Grazed,"Mountain, foothill",6-Feb,"SW, W, NW","Moderately deep well drained soils on mountains. The mean precipitation is 20 inches. Mixture of perennial grasses, juniper woodland, and sagebrush scrubland. Pine, fir, and willows in the upper elevation of the site. Warner Mountain Ecoregion. Warnermount soil type association.","Range, Gravel Pit",Formed from residuum derived of volcanic rocks.,Other : Gravelly Loam,165 plants sampled,"4,000",12,P,"A shrub with slender 3 lobed leaves that roll under on the margins. The plant grows from 2 feet to 7 feet. The leaves are alternate, tomentose on the underside, and the stems are rigid and branched. The flowers are yellow, with five petals, 5 sepals, and many stamens.",,Jen Mueller,4,,,7/12/2021,2021,,,WEB,5,10 YR 5/3,9/14/2021,PURSHIA,tridentata,2021,
'SOS-CA370-279,WYMO-SOS-CA370-279-MODOC-21,0.6050," 19,729 ",2.2991,WYMO,woolly mule-ears,Wyethia,mollis,,,,,Wyethia mollis,ASTERACEAE,WYMO,7-Jul-21,CA370-279,279,CA370,,Jen Mueller,US,80E,Northwestern Basin and Range (Omernik),California,Modoc,Surprise Field Station,"Mount Bidwell, Lartirogoyen Allotment","From Fort Bidwell, CA travel .5 miles down CO RD 1 to the junction of CO RD 1 and CO RD 6. Turn north onto CO RD 1, and drive 2 miles to the junction of CO RD 1 and CO RD 4. Turn north onto CO RD 4. Drive 4.5 miles up the road, and then a dirt road will be on the left heading West towards Mount Bidwell. Travel up this road .5 miles. This road is passable with a UTV or 4WD.","41°56' 10.3148"" N","120°05' 58.1328"" W",41.93619,-120.09948,GPS,NAD83,5764,FT,BLM,Poa secunda:Chaenactis douglasii:Purshia tridentata:Artemisia tridentata:Calochortus macrocarpus:Astragalus purshii:Lupinus argenteus:Paeonia brownii:Toxicoscordion venenosum,Burned:grazed,Mountain,Feb-40,"N, NE, E, SE, S","Moderately deep well drained soils on mountains. The mean precipitation is 20 inches. Mixture of perennial grasses, juniper woodland, and sagebrush scrubland. Pine, fir, and willows in the upper elevation of the site. Warner Mountain Ecoregion. Warnermount soil type association.",Range,Formed from residuum derived of volcanic rocks.,Other : Gravelly Loam,265 plants sampled,3000,20,P,"A perennial plant woolly in texture. The leaves are basal, often oblanceolate, and densely tomentose. Showy flower heads are born singularly or in small clusters at the end of the spike.",,Jen Mueller,4,,,,2021,,,WEB,3,10 YR 4/2,9/14/2021,WYETHIA,mollis,2021,
'SOS-CA370-280,CHDO-SOS-CA370-280-MODOC-21,0.0346," 337,249 ",0.1344,CHDO,Douglas' dustymaiden,Chaenactis,douglasii,,,,,Chaenactis douglasii,ASTERACEAE,CHDO,7-Jul-21,CA370-280,280,CA370,,Jen Mueller,US,80E,Northwestern Basin and Range (Omernik),California,Modoc,Surprise Field Station,"Mount Bidwell, Lartirogoyen Allotment","From Fort Bidwell, CA travel .5 miles down CO RD 1 to the junction of CO RD 1 and CO RD 6. Turn north onto CO RD 1, and drive 2 miles to the junction of CO RD 1 and CO RD 4. Turn north onto CO RD 4. Drive 4.5 miles up the road, and then a dirt road will be on the left heading West towards Mount Bidwell. Travel up this road .5 miles. This road is passable with a UTV.","41°56' 10.3148"" N","120°05' 58.1328"" W",41.93619,-120.09948,GPS,NAD83,5764,FT,BLM,Poa secunda:Wyethia mollis:Purshia tridentata:Artemisia tridentata:Calochortus macrocarpus:Paeonia brownii:Astragalus purshii:Toxicoscordion venenosum,Grazed,Mountain,Feb-40,"N, NE, E, SE, S","Moderately deep well drained soils on mountains. The mean precipitation is 20 inches. Mixture of perennial grasses, pine woodland, and sagebrush scrubland. Pine, fir, and juniper present. Warner Mountain Ecoregion. Warnermount-Crazybird soil type association.",Range,Formed from residuum derived of volcanic rocks.,Other : Gravelly Loam,165 plants sampled,350,20,P,"A biennial forb rising from a basal rosette of gray green multilobed lacy leaves. The leaves are woolly, with tiny, tubular flowers on a flat-topped cyme. Flowers are white to pinkish, and the fruit is an achene with a pappus.",,Jen Mueller,4,,,,2021,,,WEB,1,10 YR 4/2,9/14/2021,CHAENACTIS,douglasii,2021,
'SOS-CA370-281,APAN2-SOS-CA370-281-MODOC-21,0.0069," 2,860,025 ",0.0158,APAN2,spreading dogbane,Apocynum,androsaemifolium,,,,,Apocynum androsaemifolium,APOCYNACEAE,APAN2,9-Sep-21,CA370-281,281,CA370,,Jennifer Mueller,US,80E,Northwestern Basin and Range (Omernik),California,Modoc,Surprise Field Station,"Warner Mountains, Fandango Pass","From Lake City, CA drive 10.7 miles north on CO RD 1. At CO RD 9, take a left onto CO RD 9 and start up Fandango Pass. Drive 1.5 up the road. The site is on both sides of CO RD 9.",,"120°11' 47.2810"" W",41.79781,-120.19646,GPS,NAD83,5432,FT,BLM,Poa secunda:Wyethia mollis:Purshia tridentata:Artemisia tridentata:Lomatium triternatum:Iris missouriensis:Asclepias speciosa:Pinus ponderosa,Grazed,Mountain,30-May,"N, NE, E, SE, S","Moderately deep well drained soils on mountains. The mean precipitation is 20 inches. Mixture of perennial grasses, pine woodland, and sagebrush scrubland. Pine, fir, and juniper present. Warner Mountain Ecoregion. Warnermount-Crazybird soil type association.",Range,Formed from residuum derived of volcanic rocks.,Other : Sandy Loam,72 plants sampled,500,6,P,"Widely branching, perennial plant with oval leaves and small clusters of pink, bell shaped flowers near the branch tips. The flowers are stripped on the inside with a darker pink. Milky sap exudes from broken stems and leaves.",,Jen Mueller,4,,,,2021,,,AEL,1,10 YR 5/3,12/8/2021,APOCYNUM,androsaemifolium,2021,
'SOS-CA370-282,ASSP-SOS-CA370-282-MODOC-21,0.1560," 75,703 ",0.5991,ASSP,showy milkweed,Asclepias,speciosa,,,,,Asclepias speciosa,ASCLEPIADACEAE,ASSP,31-Aug-21,CA370-282,282,CA370,,Jen Mueller,US,80E,Northwestern Basin and Range (Omernik),California,Modoc,Surprise Field Office,"Warner Mountains, Fandango Pass","From Lake City, CA drive 10.7 miles north on CO RD 1. At CO RD 9, take a left onto CO RD 9 and start up Fandango Pass. Drive 1.7 miles to the gate to Vaughn Canyon. The site is on both sides of CO RD 9.",,"120°11' 43.2867"" W",41.79704,-120.19535,GPS,NAD83,5331,FT,BLM,Poa secunda:Wyethia mollis:Purshia tridentata:Lomatium tracyi:Lomatium triternatum:Iris missouriensis:Apocynum androsaemifolium:Pinus ponderosa:Artemisia tridentata,Grazed,Mountain,30-May,"N, NE, E, SE",Sagebrush Steppe,Range,Formed from residuum derived from volcanic rock.,Other : Sandy Loam,85 plants sampled,105,6,P,"A hairy erect perennial with large, opposite arranged leaves. Fuzzy star-like pink to pinkish-purple flowers are arranged in thick umbels. The fruit is large and covered in soft spines.",,Jen Mueller,2,,,9/2/2021,9/7/2021,,,AEL,3,10 YR 5/3,12/8/2021,ASCLEPIAS,speciosa,2021,
'SOS-OR010-435,LECI4-SOS-OR010-435-LAKE-21,0.0350," 127,408 ",0.3560,LECI4,basin wildrye,Leymus,cinereus,,,,,Leymus cinereus,POACEAE,LECI4,28-Jun-21,OR010-435,435,OR010,,"V. Ruud, K. Antonio",US,80E,Northwestern Basin and Range (Omernik),Oregon,Lake,Alkali Valley,Alkali Buttes,"65 miles north of Lakeview, OR on route 395. Turn left on Bacon Camp Rd for 4 miles.","43°00 59.3964"" N","120°03' 03.0276"" W",43.01649,-120.05084,GPS,NAD83,4269.3,FT,BLM,Achnatherum hymenoides:Artemisia tridentata ssp. wyomingensis:Chrysothamnus viscidiflorus ssp. viscidiflorus:Chrysothamnus viscidiflorus:Hesperostipa comata ssp. comata:Tetradymia glabrata:Distichlis spicata:Bromus tectorum:Sarcobatus vermiculatus,Grazed,Footeslope,3,SW,Sagebrush Steppe,"Recreation, Hunting, Ohv, Grazing",Volcanic ash and eolian deposits derived from mixed volcanic rock,"Clay, Silt : Loam",474 plants sampled,800+,200,P,"Large, coarse, perennial bunchgrass, about 3 to 6 feet tall, 3 ft in diameter max. Leaf blades are 15 to 25 inches long, and flat, wide up to 3/4 inches. Long ligules. Inflorescence is dense and tall. Seed heads are 6 to 10 inches long, true unbranched spike, 2-7 spikelets per node. Spikelets are 9-25 mm long, glumes are awnless, smooth, keeled; lemma tips are acut or minimally awned; anthers are show in Spring/early Summer, 4-7 mm long.",,"V. Ruud, Lakeview BLM; K. Antonio, Lakeview BLM",3,,,7/26/2021,2021,2,,WEB,5-Mar,2.5Y 5/2,9/10/2021,LEYMUS,cinereus,2021,
'SOS-OR010-436,ACHY-SOS-OR010-436-LAKE-21,0.0339," 308,655 ",0.1469,ACHY,Indian ricegrass,Achnatherum,hymenoides,,,,,Achnatherum hymenoides,POACEAE,ACHY,29-Jun-21,OR010-436,436,OR010,,"K. Antonio, V. Ruud",US,80E,Northwestern Basin and Range (Omernik),Oregon,Lake,Alkali Valley,Alkali Buttes,"65 miles North of Lakeview, OR on route 395. Turn left on Bacon Camp Road, heading west for 4 miles.","43°00 59.4288"" N","120°03' 02.9412"" W",43.0165,-120.05081,GPS,NAD83,4273.9,FT,BLM,Leymus cinereus:Artemisia tridentata ssp. wyomingensis:Chrysothamnus viscidiflorus:Hesperostipa comata ssp. comata:Tetradymia glabrata:Distichlis spicata:Bromus tectorum:Sarcobatus vermiculatus,Grazed,Footeslope,3,NE,Juniper-Sagebrush Steppe,"Hunting, Grazing, Recreation, Ohv",Volcanic ash and eolian deposits derived from mixed volcanic rock,Clay Silt Loam,250 plants sampled,350,19,P,"Perennial bunchgrass with narrow, rolled leaf blades. Grows to about 1.5 ft tall, 1 foot wide diameter. Inflorescence is open, very airy, branching, spreading panicle with a single flower at the end of each hairlike branch. Lemmas are densely pilose, visible without magnification.",,"K. Antonio, Lakeview BLM; V. Ruud, Lakeview BLM",3,,,,2021,2,,AEL,2,2.5Y 5/2,10/27/2021,ACHNATHERUM,hymenoides,2021,
'SOS-OR010-438,ELEL5-SOS-OR010-438-LAKE-21,0.0204," 196,227 ",0.2311,ELEL5,squirreltail (Bottlebrush),Elymus,elymoides,,,,,Elymus elymoides,POACEAE,ELEL5,6-Jul-21,OR010-438,438,OR010,,V. Ruud,US,80E,Northwestern Basin and Range (Omernik),Oregon,Lake,Oatman Flat,Oatman West,"From Silver Lake, OR, head north on OR-31 for 9.3 miles. Turn left on the dirt road with Juniper trees off the highway, one Juniper tree is dedicated to Breast Cancer Awareness, the gate to the pasture is on the left.","43°13' 58.0440"" N","121°08' 37.3920"" W",43.23279,-121.14372,GPS,NAD83,4350,FT,BLM,Artemisia tridentata ssp. wyomingensis:Chrysothamnus viscidiflorus:Ericameria nauseosa:Juniperus occidentalis:Bromus tectorum:Lomatium triternatum:Eriogonum crosbyae:Linum lewisii:Centaurea solstitialis,,Footeslope,3,NE,Sagebrush Steppe,Grazing,Volcanic ash over residuum derived from volcanic rock such as basalt,Sand,60 plants sampled,200,1,P,"Perennial bunchgrass, stands about 1 foot tall, leaves are hairy (feel soft), inflorescence is 2 to 3 inches long, the awns turn a golden/purple color as seeds start maturing, awn stick out at a perpendicular angle from the stem when mature.",,"V. Ruud, Lakeview BLM; K. Antonio, Lakeview BLM",3,,,,2021,2,,WEB,1,10 YR 5/2,9/10/2021,ELYMUS,elymoides,2021,
'SOS-OR010-439,PSSP6-SOS-OR010-439-LAKE-21,0.0137," 187,391 ",0.2420,PSSP6,bluebunch wheatgrass,Pseudoroegneria,spicata,,,,,Pseudoroegneria spicata,POACEAE,PSSP6,14-Jul-21,OR010-439,439,OR010,,K. Antonio,US,80E,Northwestern Basin and Range (Omernik),Oregon,Lake,Juniper Mountain,Pasture along Bacon Camp Rd,"From Lakeview, OR, head north on US-395 for 65 miles. Turn right on Bacon Camp Road for 4.3 miles.","42°59' 47.5980"" N","119°57' 19.9944"" W",42.99655,-119.95555,GPS,NAD83,5159,FT,BLM,Leymus cinereus:Artemisia tridentata ssp. wyomingensis:Erigeron filifolius:Calochortus macrocarpus:Calochortus macrocarpus:Achnatherum hymenoides:Crepis acuminata:Chrysothamnus viscidiflorus:Elymus elymoides:Allium acuminatum:Poa secunda:Camassia quamash:Toxicoscordion venenosum:Achnatherum thurberianum:Bromus tectorum,Grazed,Lava plateaus,20,SE,Sagebrush Steppe,Grazing,"Old alluvium and colluvium derived from volcanic rock such as basalt, rhyolite, tuff, and andesite",Clay Silt Loam,726 plants sampled,2000+,16,P,Bunchgrass. Culms 1 to 2ft tall. Inflorescence is a true spike. Awns recurved to 90 degrees when spikelets have dried. Glumes are as wide and long as other floret structures.,,"C. Anderson, Lakeview BLM",3,,,7/19/2021,2021,2,,WEB,2,2.5Y 5/3,10/4/2021,PSEUDOROEGNERIA,spicata,2021,
'SOS-OR010-440,PUTR2-SOS-OR010-440-LAKE-21,0.1654," 27,284 ",1.6624,PUTR2,antelope bitterbrush,Purshia,tridentata,,,,,Purshia tridentata,ROSACEAE,PUTR2,28-Jul-21,OR010-440,440,OR010,,"K. Antonio, V. Ruud",US,80E,Northwestern Basin and Range (Omernik),Oregon,Lake,Lynch-Flynn,West Pasture,"From Lakeview, OR, head North on US-395 for 5 miles. Turn right on OR-140, heading east for 15.6 miles. Turn left on County Hwy 3-13/Plush Cutoff Rd, heading north for 6.4 miles. Turn left and park on dirt driveway surrounded by Purshia tridentata bushes.",,"120°03' 16.2144"" W",42.30089,-120.0545,GPS,NAD83,5610,FT,BLM,Artemisia arbuscula:Artemisia tridentata ssp. wyomingensis:Chrysothamnus viscidiflorus:Tetradymia canescens:Juniperus occidentalis:Elymus elymoides:Achnatherum thurberianum:Poa secunda:Poa bulbosa:Bromus tectorum,Grazed,Footeslope,5,"SE, S, SW",,"Grazing, Recreation",Colluvium derived from tuff and basalt,Sandy Clay Loam,181 plants sampled,900+,2,P,"Deciduous shrub growing 2 to 6 feet tall. Leaves are slender, 3 to 5 lobed, 5 to 20 mm long, waxy green color. Flowers are pale yellow with 5 petals, 6 to 8 mm long, and darker yellow anthers. Fruits are clusters of red berries with dry to become slender to bulbous, leathery achenes, 0.5 to 2cm long.",,"K. Antonio, Lakeview BLM; V. Ruud, Lakeview BLM",0,,,8/2/2021,8/3/2021,2,,WEB,6,7.5YR 3/2,10/5/2021,PURSHIA,tridentata,2021,
'SOS-CA650-133,AMTE3-SOS-CA650-133-KERN-21,0.0978,120824,0.3754,AMTE3,bristly fiddleneck,Amsinckia,tessallata,,,,,Amsinckia tessellata,BORAGINACEAE,AMTE3,5-May-21,CA650-133,133,CA650,,"Mirkes, M; Heine, M; Lisak, A",US,14E,Mojave Basin and Range (Omernik),California,Kern,Kiavah Wilderness,,"From Inyokern, take HWY 14 South for about 11.3 miles. Take a right onto dirt road going north west and follow for 5.7 miles. Keep left at the fork and continue NW for another 5 miles. Population is off of the road to the north, up slope about 200 ft.","35°34' 11.61"" N","118°05' 52.85"" W",35.56989,-118.09801,GPS,NAD83,4695,FT,BLM,Astragalus sp.:Erodium cicutarium:Bromus madritensis:Lycium cooperi:Yucca brevifolia:Ericameria sp.:Eriogonum deflexum:Mentzelia affinis:Chamaesyce albomarginata,Grazed,Foothill,15,SW,,Grazing/Recreation,"Plutonic rocks (Mesozoic) - Mesozoic granite, quartz monzonite, granodiorite, and quartz diorite",Sand,555 plants sampled,3000,0.5,P,"Plants densely hairy, flowers yellow with orange spots in throat",,"Mirkes, M; Heine, M; Lisak, A",3,,,5/10/2021,2021,2,,WEB,0.5,10YR 4/4,12/7/2021,AMSINCKIA,tessellata,2021,
'SOS-MD1-16,AMFI-SOS-MD1-16-MOHAVE-21,0.0049," 2,281,690.00 ",0.0198,AMFI,fringed amaranth,Amaranthus,fimbriatus,,,,,Amaranthus fimbriatus,AMARANTHACEAE,AMFI,22-Sep-21,MD1-16,16,MD1,,"Mirkes, M; Heine, M; Lisak, A",US,14E,Mojave Basin and Range (Omernik),Arizona,Mohave,Kingman Field Office,,"From Kingman, AZ, take Hualapai Mountain Rd (HWY 147) southeast for 4.7 miles. Turn left going north onto dirt road, crossing over cattle guard and past BLM information sign. Continue north on dirt road for 0.3 miles. Population is right off of road to the east",,"113°57' 33.45"" W",35.16665,-113.95929,GPS,NAD83,4266,FT,BLM,Yucca baccata:Gutierrezia sarothrae:Pectis papposa:Opuntia basilaris:Cylindropuntia sp.:Acacia greggii:Parkinsonia microphylla,Grazed,Foothills,3,"N, NW",TAENIATHERUM caput-medusae/ARTEMISIA tridentata dominated habitat *OR does not have ecological site descriptions or soil mapping,"Grazing, Dispersed Camping, Recreation","Early Proterozoic Metamorphic Rocks - Undivided metasedimentary, metavolcanic, and gneissic rocks",Sand,2086 plants sampled,"10,000+",5,P,,,"Mirkes, M; Heine, M; Lisak, A",3,,,,2021,2,,WEB,2,"Dry: 10YR 5/3, Wet: 7.5YR 3/2",12/7/2021,AMARANTHUS,fimbriatus,2021,
