Source Lot,Source Code,Lbs Shipped,Seeds/Lb,100-Seed Wt (G),Species Code,Common Name,Genus,Species,label ss,SubSpecies,label var,Variety,NAME,FAMILY,ABBREV_NAME,COLL_DT,ACC_NUM,COLL_NUM,COLL_ID,COLLECTOR,COLLECTED_WITH,COUNTRY_CODE,PHYTOREGION,PHYTOREGION_FULL,SUB_CNT1,SUB_CNT2,SUB_CNT3,GEOG_AREA,LOCALITY,LATITUDE,LONGITUDE,LATITUDE_DECIMAL,LONGITUDE_DECIMAL,GEOREF_SOURCE,GPS_DATUM,ALTITUDE,ALTITUDE_UNIT,LAND_OWNER,ASSOCIATED_TAXA_FULL,USER2,GEOMORPHOLOGY,SLOPE,ASPECT,HABITAT,USER1,GEOLOGY,SOIL_TYPE,COLLECTION_MISC,POPULATION_SIZE,OCCUPANCY,SEED_SOURCE,DESCRIPTION,USER3,USER4,USER5,KEYWORD,PSOURCE_FULL,SECOND_COLL_DT,DATE_AS_GIVEN,USER10,SECONDARY_ID,CREATED_BY,USER8,USER9,ACC_DT,GENUS,SPECIES,COLL_YR,MISC
'SOS-OR110-1101,SPDO-SOS-OR110-1101-JACKSON-21,0.0009," 14,727,272 ",0.0030,SPDO,rose spirea,Spirea,douglasii,,,,,Spiraea douglasii,ROSACEAE,SPDO,16-Sep-21,OR110-1101,1101,OR110,,"Rebekah Bergkoetter, Sage Stowell",US,9E,Eastern Cascade Slopes and Foothills (Omernik),Oregon,Jackson,39-4E-23,Jenny Creek Road,"Take HWY 66 to Jenny Creek road, shrub patch is located by a creek crossing",,"122°18' 28.1"" W",42.15769,-122.3078,GPS,NAD83,3737,FT,BLM,Pinus ponderosa:Ceanothus prostratus:Symphoricarpos albus:Apocynum androsaemifolium,Grazed:roadside,Stream terrace,2,SW,R005XY010OR-Wet Meadow,Road/Roadside/Utility,Basalitc andesite,Loam,50 plants sampled,200,0.2,P,"Elongated inflorescence, fruit a follical",,"Sage Stowell, Rebekah Bergkoetter",3,,,,2021,0,,WEB,3.5,5 YR 4/6 (Munsell),9/20/2021,SPIRAEA,douglasii,2021,
'SOS-OR110-1102,NALE-SOS-OR110-1102-JACKSON-21,0.0151," 790,794 ",0.0573,NALE,whitehead navarretia,Navarretia,leucocephala,,,,,Navarretia leucocephala,POLEMONIACEAE,NALE,16-Sep-21,OR110-1102,1102,OR110,,"Sage Stowell, Rebekah Bergkoetter",US,9E,Eastern Cascade Slopes and Foothills (Omernik),Oregon,Jackson,39S-4E-23,Moon Prairie Road,"Take HWY 66 to Jenny Creek Road, left on Moon Prairie Road, park by a large open meadow",,"122°18' 36.4"" W",42.31011,-122.31011,GPS,NAD83,3853,FT,BLM,Pinus ponderosa:Croton setigerus,Grazed,Arroyo,0,SW,F005XB101CA-Douglas fir/tanoak,Road/ Roadside/Utility,Late high cascades volcanics basalt,Other : Loam,200 plants sampled,"10,000",0.5,P,"Narrow petals, few short hairs on the inflorescence, white flowers, membrane wing on bract",,Rebekah Bergkoetter,0,,,,2021,1,,WEB,0.1,10YR 4/1 (Munsell),9/20/2021,NAVARRETIA,leucocephala,2021,
'SOS-OR110-1103,ARPA6-SOS-OR110-1103-JACKSON-21,0.6550," 19,303 ",2.3498,ARPA6,greenleaf manzanita,Arctostaphylos,patula,,,,,Arctostaphylos patula,ERICACEAE,ARPA6,21-Sep-21,OR110-1103,1103,OR110,,"S. Stowell, R. Bergkoetter",US,9E,Eastern Cascade Slopes and Foothills (Omernik),Oregon,Jackson,39S-4E-23,Jenny Creek,"Take Highway 66 to Jenny Creek Road, park by Johnson Creek.",,"122°18' 24.5"" W",42.15722,-122.3068,GPS,NAD83,3758,FT,BLM,Pinus ponderosa:Pseudotsuga menziesii:Spiraea douglasii:Ceanothus prostratus:Symphoricarpos albus,Grazed,Hillslope,15,SW,F005XB101CA-Douglas fir/tanoak,Grazing,Basaltic andesite,Gravelly Loam,50 plants sampled,300,1,P,"Green on both sides of leaf, not glaucous. Bark red. Fruit brown/red.",,"S. Stowell, R. Bergkoetter",3,,,,2021,2,,WEB,5,10YR 3/3 (Munsell),9/29/2021,ARCTOSTAPHYLOS,patula,2021,
'SOS-OR110-1105,LOCA3-SOS-OR110-1105-JACKSON-21,0.5880," 21,944 ",2.0670,LOCA3,California lomatium,Lomatium,californicum,,,,,Lomatium californicum,APIACEAE,LOCA3,23-Sep-21,OR110-1105,1105,OR110,,"Sage Stowell, Rebekah Bergkoetter",US,9E,Eastern Cascade Slopes and Foothills (Omernik),Oregon,Jackson,40S-4E-35,Copco Road/Box O,Turn south onto Copco Rd from HWY 66. Turn left onto BLM Rd 40-%E-3 after 2 miles. Turn south to 40-$E-23 after additional 2 miles. Turn left after .5 miles to 40-4E-24,,"122°18' 53.5"" W",40.04455,-122.31486,GPS,NAD83,3839,FT,BLM,Ceanothus integerrimus:Quercus garryana:Poa bulbosa:Penstemon deustus:Cercocarpus betuloides,Burned,Hillslope,25,SW,"Desert foothills, washes",Road/Roadside/Utilities,Basalt-early high Cascade volcanics,Loam,200 plants sampled,500,0.5,P,"Wide leaves, fruit not notched or with dorsal wings",,"Sage Stowell, Rebekah Bergkoetter",0,,,,2021,0,,WEB,2.5,10YR 5/2 (Munsell),9/29/2021,LOMATIUM,californicum,2021,
'SOS-AZ932-154,SACO6-SOS-AZ932-154-MOHAVE-21,0.0221,533647,0.0849,SACO6,chia,Salvia,columbariae,,,,,Salvia columbariae,LAMIACEAE,SACO6,30-Mar-21,AZ932-154,154,AZ932,,Jessica Esplin,US,14E,Mojave Basin and Range (Omernik),Arizona,Mohave,,,"South of Kingman, west of southbound Highway 93, unnamed BLM road","34°51' 7.416"" N","113°38' 28.4634"" W",34.85206,-113.64123,GPS,WGS84,2345,FT,BLM,Parkinsonia aculeata:Larrea tridentata:Fouquieria splendens:Ambrosia dumosa:Eriogonum fasciculatum,,Washes and roadside,10,SW,"Desert foothills, steep slopes",Blm,Decomposing granite,Sand,200 plants sampled,1000,55,P,,,Sheila Murray,3,,,3/31/2021,2021,2,,WEB,0.5,light brown tan,7/30/2021,SALVIA,columbariae,2021,
'SOS-AZ932-155,SACO6-SOS-AZ932-155-MOHAVE-21,0.031,388422,0.1167,SACO6,chia,Salvia,columbariae,,,,,Salvia columbariae,LAMIACEAE,SACO6,17-Apr-21,AZ932-155,155,AZ932,,Jessica Esplin,US,14E,Mojave Basin and Range (Omernik),Arizona,Mohave,,,"South of Kingman, AZ, west of southbound Hwy 93, west on Blake Ranch Rd, County Highway 129","34°58' 0.6954"" N","113°42' 24.696"" W",34.96685,-113.70686,GPS,WGS84,3550,FT,BLM,Larrea tridentata:Cylindropuntia sp.:Eriogonum fasciculatum,,"Drainages, roadside",25,S,"Washes, desert foothills",Blm,Decomposing granite,Sand,440 plants sampled,2200,200,P,,,Sheila Murray,3,,,4/23/2021,2021,2,,WEB,0.5,light brown,7/30/2021,SALVIA,columbariae,2021,
'SOS-AZ932-156,SACO6-SOS-AZ932-156-MOHAVE-21,0.0282,410052,0.1106,SACO6,chia,Salvia,columbariae,,,,,Salvia columbariae,LAMIACEAE,SACO6,14-Apr-21,AZ932-156,156,AZ932,,Jessica Esplin,US,14E,Mojave Basin and Range (Omernik),Arizona,Mohave,,,"South of Kingman, AZ, on county Highway 10 Oatman Road to Night Owl Road, past the town of Oatman.","35°0 16.524"" N","114°23' 58.9194"" W",35.00459,-114.39969,GPS,WGS84,2257,FT,BLM,Larrea tridentata:Ephedra nevadensis:Cylindropuntia sp.:Encelia farinosa:Yucca sp.,,"Washes, roadside",10,SW,"Roadsides, drainages",Blm,"Granite, agate, volcanic basalt",Sand,520 plants sampled,2600,100,P,,,Sheila Murray,3,,,4/28/2021,2021,2,,WEB,0.5,"Light brown, grey",7/30/2021,SALVIA,columbariae,2021,
'SOS-AZ932-158,BAMU-SOS-AZ932-158-MOHAVE-21,0.0172,671800,0.0675,BAMU,desert marigold,Baileya,multiradiata,,,,,Baileya multiradiata,ASTERACEAE,BAMU,7-Apr-21,AZ932-158,158,AZ932,,Jessica Esplin,US,14E,Mojave Basin and Range (Omernik),Arizona,Mohave,,,"South of Kingman, AZ, west of southbound Hwy 93, unnamed BLM road west of Carpenter Ranch Rd.","34°52' 3.4674"" N","113°38' 40.5594"" W",34.86762,-113.64459,GPS,WGS84,2355,FT,BLM,Parkinsonia aculeata:Larrea tridentata:Ambrosia dumosa:Salvia columbariae,,"Washes, roadside",3,S,"Desert foothills, steep slopes, roadside",Blm,Decomposing granite,Sand,56 plants sampled,281,465,P,,,Sheila Murray,3,,,4/18/2021,4/23/2021,2,,WEB,1.2,tan/brown,7/30/2021,BAILEYA,multiradiata,2021,
'SOS-AZ932-159,BAMU-SOS-AZ932-159-MOHAVE-21,0.006,682310,0.0664,BAMU,desert marigold,Baileya,multiradiata,,,,,Baileya multiradiata,ASTERACEAE,BAMU,18-Apr-21,AZ932-159,159,AZ932,,Jessica Esplin,US,14E,Mojave Basin and Range (Omernik),Arizona,Mohave,,,"South of Kingman, AZ, west of southbound Hwy 93, west on Blake Ranch Road, County Hyway 129.","34°58' 1.4514"" N","113°42' 36.8634"" W",34.96706,-113.71023,GPS,WGS84,3602,FT,BLM,Larrea tridentata:Senegalia greggii:Encelia farinosa:Salvia columbariae,,Steep slopes,20,SW,Desert foothills,Blm,Decomposing granite,Sand,50 plants sampled,250,85,P,,,Sheila Murray,3,,,4/23/2021,2021,2,,AEL,1.5,tan/grey,12/8/2021,BAILEYA,multiradiata,2021,
'SOS-AZ932-164,BAMU-SOS-AZ932-164-MOHAVE-21,0.0162,621880,0.0729,BAMU,desert marigold,Baileya,multiradiata,,,,,Baileya multiradiata,ASTERACEAE,BAMU,27-Apr-21,AZ932-164,164,AZ932,,Jessica Esplin,US,14E,Mojave Basin and Range (Omernik),Arizona,Mohave,,,"South of westbound I-40, exit 59 DW Ranch Road","35°11' 41.3154"" N","113°54' 19.476"" W",35.1948,-113.90541,GPS,WGS84,4093,FT,BLM,Cylindropuntia echinocarpa:Ephedra nevadensis:Senegalia greggii:Penstemon palmeri,,"Roadsides, washes",10,S,Desert wash,Blm,Decomposing granite,Sand,60 plants sampled,60,80,P,,,Sheila Murray,3,,,5/8/2021,5/20/2021,2,,WEB,1.5,"tan, brown",7/30/2021,BAILEYA,multiradiata,2021,
'SOS-AZ932-169,CHLI2-SOS-AZ932-169-MOHAVE-21,0.227,60817,0.7458,CHLI2,desert willow,Chilopsis,linearis,,,,,Chilopsis linearis,BIGNONIACEAE,CHLI2,14-Oct-21,AZ932-169,169,AZ932,,"Sheila Murray, Jessica Esplin",US,14E,Mojave Basin and Range (Omernik),Arizona,Mohave,,,"NE of Kingman, AZ, near Hackberry junction, small BLM parcel off Route 66.","35°21' 33.48"" N","113°41' 40.776"" W",35.3593,-113.69466,GPS,WGS84,3665,FT,BLM,Larrea tridentata:Muhlenbergia porteri:Yucca sp.,,Wash,5,S,Artemisia tripartita grasslands,Blm,Decomposing granite,Sand,200 plants sampled,500,20,P,,,Sheila Murray,3,,,,2021,2,,WEB,8-15',tan,12/7/2021,CHILOPSIS,linearis,2021,
'SOS-WY050-230,ARFU3-SOS-WY050-230-FREMONT-21,0.0330," 346,524 ",0.1308,ARFU3,foothill arnica,Arnica,fulgens,,,,,Arnica fulgens,ASTERACEAE,ARFU3,24-Jun-21,WY050-230,230,WY050,,"Freeland, E., Cross, R.",US,18E,Wyoming Basin (Omernik),Wyoming,Fremont,Red Canyon Area of Critical Environmental Concern,,"Foothills of the Wind River Range; Red Canyon, in the vicinity of Derby Springs. From the Red Canyon Scenic overlook, drive W on Hwy 28 approx. 1 mile to a large pull off and a two track on the N side of the Highway. Collection is approximately 300 m north of here.","42°35' 46.8"" N","108°38' 01.4"" W",42.59633,-108.63372,GPS,WGS84,7100,FT,BLM,Lomatium foeniculaceum:Pascopyrum smithii:Balsamorhiza incana:Astragalus miser:Allium textile:Nassella viridula:Artemisia tripartita,,Hillslope,10,E,Grasslands and sagebrush grasslands on sandy soils derived from nugget sandstone,"Grazing, Recreation",White River formation,Silty Clay,5000 plants sampled,10000,50,P,,,E. Freeland - BLM,3,,,,2021,2,Emma E. Freeland 8399,WEB,1,7.5 YR 4/2,11/18/2021,ARNICA,fulgens,2021,
'SOS-WY050-231,HECOC8-SOS-WY050-231-FREMONT-21,0.2093," 63,648 ",0.7126,HECOC8,needle and thread,Hesperostipa,comata,spp.,comata,,,Hesperostipa comata ssp. comata,POACEAE,HECOC8,28-Jun-21,WY050-231,231,WY050,,"Freeland, E., Cross, R., Smith, K., Wehner, N., Bella, K., Bukowski, K.",US,18E,Wyoming Basin (Omernik),Wyoming,Fremont,Madison Creek Allotment,,"Population is on BLM lands but permission is needed to cross private in Grand Cedars Subdivision. From Lander, drive S 10 miles, then take a right onto Willow Creek Rd. Travel approx 3 miles, then turn L onto Grand Cedars Road. Follow that to where it ends at BLM lands. Population is S of parking area on BLM land.","42°42' 11.1"" N","108°40' 57.3"" W",42.70308,-108.68258,GPS,WGS84,6000,FT,BLM,Artemisia nova:Opuntia polyacantha:Chrysothamnus viscidiflorus:Calochortus nuttallii,,Hillslop,5,"E, SE, S, SW, W",Wetter areas in Artemisia tripartita grasslands,"Grazing, Recreation",Nugget sandstone,Sand,10000 plants sampled,13000,100,P,,,E. Freeland - BLM,3,,,6/30/2021,Also 07/01/21 and 07/06/21,1,Emma E. Freeland 8398,WEB,3,5YR 5/4,11/18/2021,HESPEROSTIPA,comata,2021,
'SOS-WY050-232,GETRC2-SOS-WY050-232-FREMONT-21,0.0166," 711,194 ",0.0637,GETRC2,old man's whiskers,Geum,triflorum,,,var.,ciliatum,Geum triflorum var. ciliatum,ROSACEAE,GETRC2,29-Jun-21,WY050-232,232,WY050,,"Freeland, E., Wehner, N.",US,18E,Wyoming Basin (Omernik),Wyoming,Fremont,Red Canyon Area of Critical Environmental Concern,,"Foothills of the Wind River Range; Red Canyon, in the vicinity of Derby Springs. From the Red Canyon Scenic Overlook, travel west on Highway 28 approximately 1 mile to a pulloff on the N side of the highway. Collection area is approximately 300 feet N of here.","42°35' 46.8"" N","108°38' 01.4"" W",42.59633,-108.63372,GPS,WGS84,7100,FT,BLM,Arenaria congesta:Balsamorhiza incana:Festuca idahoensis:Artemisia tripartita,,Hillslop,10,"N, NE, E, SE, S, SW, W, NW",Wetter areas within Artemisia tripartita grasslands.,"Grazing, Recreation",White River Formation,Other : Silty Clay,1500 plants sampled,5000,5,P,"Inflorescence pink, nodding.",,E. Freeland - BLM,0,,,,,2,,WEB,0.5,7.5 YR 4/2,11/18/2021,GEUM,triflorum,2021,
'SOS-WY050-233,JUARL-SOS-WY050-233-FREMON-21,0.0009," 11,812,500 ",0.0038,JUARL,mountain rush,Juncus,arcticus,spp.,littoralis,,,Juncus arcticus ssp. littoralis,JUNCACEAE,JUARL,14-Jul-21,WY050-233,233,WY050,,"Cross, R., Bella, K., Bukowski, K., Smith, K.",US,20E,Colorado Plateau (Omernik),Wyoming,Fremont,Red Canyon Area of Critical Environmental Concern,,"Foothills of the Wind River Range; Red Canyon, in the vicinity of Derby Springs. From the Red Canyon Scenic Overlook, travel W on Highway 28 approximately 1 mile to a large pulloff on the N side of the highway. The collection area is approximately 600 meters NW of here.","42°35' 53.17"" N","108°38' 18.19"" W",42.5981,-108.63838,GPS,WGS84,7100,FT,BLM,Arnica fulgens:Balsamorhiza incana:Poa secunda:Pascopyrum smithii:Achillea millefolium:Thermopsis rhombifolia,,Drainage,3,"N, NE, E, SE, S, SW, W, NW",Wyoming big sagebrush steppe,"Grazing, Recreation",White River Formation,Other : Sandy Clay Loam,10000 plants sampled,15000,50,P,,,E. Freeland - BLM,3,,,7/15/2021,7/22/2021,2,Cross s.n.,WEB,1,7.5 YR 2.5/2,11/18/2021,JUNCUS,arcticus,2021,
'SOS-WY050-234,ARTRW8-SOS-WY050-234-FREMONT-21,0.0065," 1,739,263 ",0.0260,ARTRW8,Wyoming big sagebrush,Artemisia,tridentata,spp.,wyomingensis,,,Artemisia tridentata ssp. wyomingensis,ASTERACEAE,ARTRW8,18-Oct-21,WY050-234,234,WY050,,"Freeland, E., Cross, R., Yandow, L., Mott, J., Renner, S., Coyne, M., Clingerman, G., Whitford, N., Hegg, S., Mahoney, A.",US,18E,Wyoming Basin (Omernik),Wyoming,Fremont,Government Draw Allotment,,"From Hudson, travel E on E 1st for 1.5 miles to where the road turns south to enter public lands. Follow for approximately 2 miles. Collection site is along both sides of this road, called the Hudson Atlantic City Road.","42°53' 44.2"" N","108°32' 33.6"" W",42.89561,-108.54266,GPS,WGS84,,FT,BLM,Bouteloua gracilis:Elymus lanceolatus:Castilleja angustifolia,,Rolling hills,5,"N, NE, E, SE, S, SW, W, NW",Naturally occurring mid-elevation meadow fen surrounded by coniferous forest primarily Douglas fir (Pseudotsuga menziesii) and true firs. Dense patches of vine maple and hawthorne encroach into meadows.,"Grazing, Recreation",Wind River Formation,Other : Loam,5000 plants sampled,1000000,100,P,,,E. Freeland - BLM,3,,,10/21/2021,10/22/2021,2,Emma E. Freeland 8402,WEB,2,10YR 4/2,11/18/2021,ARTEMISIA,tridentata,2021,
'SOS-OR090B-307,CALU7-SOS-OR090B-307-DOUGLAS-21,0.0102," 1,094,594 ",0.0414,CALU7,woodrush sedge,Carex,luzulina,,,,,Carex luzulina,CYPERACEAE,CALU7,7-Jul-21,OR090B-307,307,OR090B,,"Linden, S., Wittkop, E.",US,4E,Cascades (Omernik),Oregon,Douglas,Upper Willamette Field Office,Elk Meadow,"Take I-5 south to Cottage Grove exit 172, Cottage Grove Lake. Turn left at the off-ramp traffic light onto 6th St, which turns into the London Road, and drive south around the reservoir. Drive past the junction with Cottage Grove Reservoir Road and continue through the town of London Springs to Big River Road (approximately 4.1 miles past the London school). Turn left and follow this paved road, which is also called BLM road 23-3-5.4, approximately 8.6 miles to spur road 23-2-35.1 (make sure to stay right when the paved road splits before going up away from the river bottom) and go through the yellow gate. The spur road isnÃ¢âú¬âü¢t paved, but the road is good enough for a regular car. If you forget the key itÃ¢âú¬âü¢s not a long walk to the site so you can park at the gate and walk in.","43°31' 40.656"" N","-122°53' 54.3006"" W",43.52796,-122,GPS,,4215,FT,BLM,Acer circinatum:Pseudotsuga menziesii:Rhododendron macrophyllum:Sidalcea nelsoniana:Pedicularis racemosa:Rudbeckia occidentalis:Senecio triangularis:Senecio triangularis,,"Hanging fen, small wet meadow",0-5,,Grassy â€œbaldâ€ surrounded by old-growth Pseudotsuga menziesii and Tsuga heterophylla,Wildlife Habitat,Fisher and Eugene Formations and correlative rocks,Other : Loam,100 plants sampled,300,2,P,"Plants are cespitose or short-rhizomed, stems 15-90 cm, leaves 3-9 mm wide and glabrous. Upper spikelet of inflorescence sometimes clustered, lateral spikelets pistillate or tips staminate, perigynia mostly purple or green with reddish purple spots.",,E. Wittkop -- Institute for Applied Ecology,2,,,,2021,,,AEL,2,Forgot to i.d. in the field,1/11/2022,CAREX,luzulina,2021,
'SOS-OR090B-308,CAHI9-SOS-OR090B-308-LINN-21,0.0005," 4,877,419 ",0.0092,CAHI9,harsh Indian paintbrush,Castilleja,hispida,,,,,Castilleja hispida,SCROPHULARIACEAE,CAHI9,13-Jul-21,OR090B-308,308,OR090B,,"Wittkop, E., Linden, S.",US,4E,Cascades (Omernik),Oregon,Linn,Upper Willamette Field Office,Horse Rock Ridge,"Take I-5 south to exit 216 (Brownsville, Halsey). Exit and go towards Brownsville (228 E). Stay on 228 through the outskirts of Brownsville, drive through Crawfordsville, and take a right onto Brush Creek Rd (<0.5mi east of Crawfordsville). Stay on Brush Creek Rd. for several miles, then stay right the entire way. After you pass the town of Mabel, turn right onto Shotgun Creek Rd (#16-1-5). Veer right at Shotgun Creek Recreation Site, and again at Crooked Creek Staging Area. Follow the paved road past a hairpin turn and onto the top of an open area. Drive back into the woods past a shooting area and the road with parking will be after that. Turn left and park at either the first left parking area or further up the side road up near the boulder pile.","44°17' 57"" N","-122°53' 0.6"" W",44.29916,-122,GPS,,"2,500",FT,BLM,Plectritis congesta:Eriophyllum lanatum:Zigadenus venenosus:Danthonia californica,,Slopped meadow,0-50,"S, SW",Wet prairie opening surrounded by Oregon ash forest.,"Recreation, Research Natural Area",Basaltic andesite cut by dikes,Other : Loam,130 plants sampled,200,2,P,"Plants clustered, stems erect and generally unbranched, hispid. Leaves lanceolate to ovate with upper stem leaves sometimes divided into 3+ shallow lobes. Lateral lobes of bracts and upper leaves are short, arising at or above bract midpoint. Bracts bright scarlet or sometimes yellow.",,E. Wittkop,3,,,,2021,,,WEB,1.5 ft,Wet - 10YR2/1 Dry - 10YR3/2,10/25/2021,CASTILLEJA,hispida,2021,
'SOS-OR090B-310,ERLA6-SOS-OR090B-310-LANE-21,0.0043," 744,338 ",0.0609,ERLA6,common woolly sunflower,Eriophyllum,lanatum,,,,,Eriophyllum lanatum,ASTERACEAE,ERLA6,23-Jul-21,OR090B-310,310,OR090B,,"E. Wittkop, S. Linden",US,3E,Willamette Valley (Omernik),Oregon,Lane,Upper Willamette Field Office,Eagle's Rest,"Head south on I-5 from Corvallis. Take exit 188 for OR-58 toward Oakridge/Klamath Falls. Continue onto OR-58 for about 11 miles and turn right onto Lost Creek Rd. The Road will veer left; continue on Lost Creek Rd. In about three miles, turn left onto Eagles Rest Rd. Continue for 2.1 miles and turn left onto US Forest Service Rd. 509. In about 1.8 miles your destination will be on the left side.",,"-122°45' 44.2758"" W",4543.75015,-122,GPS,,944,FT,BLM,Achillea millefolium:Gilia capitata:Lupinus oreganus:Plectritis congesta,,Lower slope,50,"S, SW",Grassy â€œbaldâ€ surrounded by old-growth Pseudotsuga menziesii and Tsuga heterophylla,Wildlife Habitat,Sedimentary and volcaniclastic rocks,Other : Loam,100 plants sampled,300,0.5,P,"Low-growing subshrub. Stems erect to decumbent and usually wooly. Leaves are .5-3 in long, linear to oval, pinnately divided or entire, sessile or petiolate. Inflorescences bright yellow, ray flowers 6-20 mm, oblong to elliptic, 5-15 phyllaries.",,E. Wittkop,3,,,8/25/2021,2021,,,WEB,1.5,Forgot to i.d. in the field,10/26/2021,ERIOPHYLLUM,lanatum,2021,
'SOS-OR090B-311,POGL9-SOS-OR090B-311-LINN-21,0.0097," 1,161,290 ",0.0390,POGL9,sticky cinquefoil,Potentilla,glandulosa,,,,,Potentilla glandulosa,ROSACEAE,POGL9,13-Jul-21,OR090B-311,311,OR090B,,"Wittkop, E., Linden, S.",US,4E,Cascades (Omernik),Oregon,Linn,Upper Willamette Field Office,Horse Rock Ridge,"Take I-5 south to exit 216 (Brownsville, Halsey). Exit and go towards Brownsville (228 E). Stay on 228 through the outskirts of Brownsville, drive through Crawfordsville, and take a right onto Brush Creek Rd (<0.5mi east of Crawfordsville). Stay on Brush Creek Rd. for several miles, then stay right the entire way. After you pass the town of Mabel, turn right onto Shotgun Creek Rd (#16-1-5). Veer right at Shotgun Creek Recreation Site, and again at Crooked Creek Staging Area. Follow the paved road past a hairpin turn and onto the top of an open area. Drive back into the woods past a shooting area and the road with parking will be after that. Turn left and park at either the first left parking area or further up the side road up near the boulder pile.","44°17' 57"" N","-122°53' 0.6"" W",44.29916,-122,GPS,,"2,500",FT,BLM,Plectritis congesta:Danthonia californica:Eriophyllum lanatum:Holodiscus discolor,Burned,Slopped meadow,0-50,"S, SW",Naturally occurring mid-elevation meadow fen surrounded by coniferous forest primarily Douglas fir (Pseudotsuga menziesii) and true firs. Dense patches of vine maple and hawthorne encroach into meadows.,"Wildlife Habitat, Recreation",Basaltic andesite cut by dikes,Loam,125 plants sampled,150,1,P,"Upright and tufted plant with abundant glandular hairs at base. Leaf glabrous to glandular and pinnately divided into 5-9 ovate leaflets, with teeth Â¼-Â½ way to midvein. Flowers in loose cluster with leafy bracts. Petals generally elliptic, yellow to cream in color.",,E. Wittkop,3,,,,2021,,,WEB,1.5,Wet - 10YR2/1 Dry - 10YR3/2,10/25/2021,POTENTILLA,glandulosa,2021,
'SOS-OR090B-312,RUOC2-SOS-OR090B-312-DOUGLAS-21,0.0423," 275,912 ",0.1643,RUOC2,western coneflower,Rudbeckia,occidentalis,,,,,Rudbeckia occidentalis,ASTERACEAE,RUOC2,17-Aug-21,OR090B-312,312,OR090B,,"Linden, S., Wittkop. E",US,4E,Cascades (Omernik),Oregon,Douglas,Upper Willamette Field Office,Elk Meadow,"Take I-5 south to Cottage Grove exit 172, â€œCottage Grove Lakeâ€. Turn left at the off-ramp traffic light onto 6th St, which turns into the London Road, and drive south around the reservoir. Drive past the junction with Cottage Grove Reservoir Road and continue through the town of London Springs to Big River Road (approximately 4.1 miles past the London school). Turn left and follow this paved road, which is also called BLM road 23-3-5.4, approximately 8.6 miles to spur road 23-2-35.1 (make sure to stay right when the paved road splits before going up away from the river bottom) and go through the yellow gate. The spur road isnâ€™t paved, but the road is good enough for a regular car. If you forget the key itâ€™s not a long walk to the site so you can park at the gate and walk in",,"-122°53' 54.3006"" W",43.52796,-122,GPS,,"4,215",FT,BLM,Acer circinatum:Senecio triangularis:Sidalcea nelsoniana:Frasera umpquaensis,,"Hanging fen, small wet meadow",0-5,S,Grassy â€œbaldâ€ surrounded by old-growth Pseudotsuga menziesii and Tsuga heterophylla,Wildlife Habitat,Fisher and Eugene Formations and correlative rocks,Other : Loam,125 plants sampled,250,2,P,"Perennial and rhizomatous plant, generally unbranched or sparsely branched, glabrous to glaucous. Leaves 12-30 cm long, 3-9 cm wide, blade elliptic and coarsely serrate to entire, short hairs present on both sides of the blade. Flower heads are discoid, dark purple to brown, with no ray flowers. The cones turn black when in seed.",,E. Wittkop,3,,,9/15/2021,2021,,,WEB,2-6 ft,Forgot to i.d. in the field,10/26/2021,RUDBECKIA,occidentalis,2021,
'SOS-OR090B-314,ZIVE-SOS-OR090B-314-LINN-21,0.0396," 213,659 ",0.2122,ZIVE,meadow deathcamas,Zigadenus,venenosus,,,,,Zigadenus venenosus,MELANTHIACEAE,ZIVE,13-Jul-21,OR090B-314,314,OR090B,,"E. Wittkop, S. Linden",US,4E,Cascades (Omernik),Oregon,Linn,Upper Willamette Field Office,Horse Rock Ridge,"Take I-5 south to exit 216 (Brownsville, Halsey). Exit and go towards Brownsville (228 E). Stay on 228 through the outskirts of Brownsville, drive through Crawfordsville, and take a right onto Brush Creek Rd (<0.5mi east of Crawfordsville). Stay on Brush Creek Rd. for several miles, then stay right the entire way. After you pass the town of Mabel, turn right onto Shotgun Creek Rd (#16-1-5). Veer right at Shotgun Creek Recreation Site, and again at Crooked Creek Staging Area. Follow the paved road past a hairpin turn and onto the top of an open area. Drive back into the woods past a shooting area and the road with parking will be after that. Turn left and park at the either the first left parking area or further up the side road up near the boulder pile.","44°17' 57"" N","-122°53' 0.6"" W",44.29916,-122,GPS,,"2,500",FT,BLM,Castilleja hispida:Eriophyllum lanatum:Ranunculus occidentalis:Festuca idahoensis:Plectritis congesta,,Slopped meadow,0-50,"S, SW",Naturally occurring mid-elevation meadow surrounded by coniferous forest primarily Douglas fir (Pseudotsuga menziesii).,Recreation,Basaltic andesite cut by dikes,Other : Loam,100 plants sampled,300,5,P,"Bulbs 12-25 mm in diameter, ovate with brownish outer coat. Stems 15-70 cm, erect, glabrous. Leaves 10-40 cm, 4-10 mm wide, scabrous-ciliate. Inflorescences generally in a raceme, 5-25 cm in length. Flowers bisexual and stamens longer than petals, perianth 4-6 mm, ovate to obtuse, white to cream colored.",,E. Wittkop,3,,,,2021,,,WEB,1,Wet - 10YR2/1 Dry - 10YR3/2,10/25/2021,ZIGADENUS,venenosus,2021,
